<?xml version="1.0" encoding="ISO-8859-1" ?>
<channel version="1.0" xmlns="http://pear.php.net/channel-1.0"
  xmlns:xsi="http://www.w3.org/2001/XMLSchema-instance"
  xsi:schemaLocation="http://pear.php.net/dtd/channel-1.0 http://pear.php.net/dtd/channel-1.0.xsd">
 <name>pear.unl.edu</name>
 <summary>UNL PHP Extension and Application Repository</summary>
 <suggestedalias>unl</suggestedalias>
 <servers>
  <primary>
   <rest>

    <baseurl type="REST1.0">http://pear.unl.edu/Chiara_PEAR_Server_REST1.0/</baseurl>
    <baseurl type="REST1.1">http://pear.unl.edu/Chiara_PEAR_Server_REST1.1/</baseurl>
    <baseurl type="REST1.3">http://pear.unl.edu/Chiara_PEAR_Server_REST1.3/</baseurl>
   </rest>
  </primary>
 </servers>
</channel>